{
  "$schema": "https://json-schema.org/draft/2020-12/schema",
  "additionalProperties": false,
  "properties": {
    "from_version": {
      "type": "string"
    },
    "new_defects": {
      "items": {
        "type": "string"
      },
      "type": "array"
    },
    "overall_assessment": {
      "type": "string"
    },
    "regression_warnings": {
      "items": {
        "type": "string"
      },
      "type": "array"
    },
    "remaining_defects": {
      "items": {
        "type": "string"
      },
      "type": "array"
    },
    "resolved_defects": {
      "items": {
        "type": "string"
      },
      "type": "array"
    },
    "score_diff": {
      "type": "object"
    },
    "to_version": {
      "type": "string"
    }
  },
  "required": [
    "from_version",
    "to_version",
    "resolved_defects",
    "remaining_defects",
    "new_defects",
    "score_diff",
    "regression_warnings",
    "overall_assessment"
  ],
  "title": "ComparisonReportPayload",
  "type": "object"
}